{"$defs":{"hash":{"pattern":"^[0-9a-f]{64}$","type":"string"},"nat":{"pattern":"^(0|[1-9][0-9]*)$","type":"string"},"node":{"oneOf":[{"additionalProperties":false,"properties":{"end":{"$ref":"#/$defs/nat"},"kind":{"const":"leaf"},"start":{"$ref":"#/$defs/nat"},"unit_id":{"$ref":"#/$defs/hash"}},"required":["end","kind","start","unit_id"],"type":"object"},{"additionalProperties":false,"properties":{"end":{"$ref":"#/$defs/nat"},"kind":{"const":"split"},"left":{"$ref":"#/$defs/node"},"right":{"$ref":"#/$defs/node"},"split_after":{"$ref":"#/$defs/nat"},"start":{"$ref":"#/$defs/nat"}},"required":["end","kind","left","right","split_after","start"],"type":"object"}]},"root":{"$ref":"https://example.invalid/collatz/work-unit-v1.schema.json#/$defs/root"}},"$id":"https://example.invalid/collatz/root-partition-v1.schema.json","$schema":"https://json-schema.org/draft/2020-12/schema","additionalProperties":false,"properties":{"config_id":{"$ref":"#/$defs/hash"},"k1":{"pattern":"^[1-9][0-9]*$","type":"string"},"leaves":{"items":{"additionalProperties":false,"properties":{"end":{"$ref":"#/$defs/nat"},"start":{"$ref":"#/$defs/nat"},"unit_id":{"$ref":"#/$defs/hash"}},"required":["end","start","unit_id"],"type":"object"},"minItems":1,"type":"array"},"m":{"enum":["92","93","94","95","96"]},"partition_id":{"$ref":"#/$defs/hash"},"root":{"$ref":"#/$defs/root"},"schema":{"const":"collatz.root-partition.v1"},"tree":{"$ref":"#/$defs/node"}},"required":["config_id","k1","leaves","m","partition_id","root","schema","tree"],"title":"Exact partition of one k1 root progression","type":"object"}
