{"config_id":"39358f1f272587ce9bdd2ff4d530f9a9fe079894092f634e6b9e468bc999b419","k1":"31","leaves":[{"end":"12644383719423","start":"0","unit_id":"51f73f56d0dcb1ac23696216d7a2340065d738c0b83de5cba2a2db00a3445551"}],"m":"94","partition_id":"3552ea7a6e908a027a5871d1e976805b7afca9fcb8bd68721554d0674e3a6aa3","root":{"bits":"1","count":"12644383719424","first":"1099511627777","last":"26388279066623","residue":"1"},"schema":"collatz.root-partition.v1","tree":{"end":"12644383719423","kind":"leaf","start":"0","unit_id":"51f73f56d0dcb1ac23696216d7a2340065d738c0b83de5cba2a2db00a3445551"}}
