{"config_id":"b95bbdd3004aa0147070166059cccb4b7e0db7a131150f253e6fcb6c6f102098","k1":"52","leaves":[{"end":"1651506","start":"0","unit_id":"dc46c635602629a1993c9667f180c502bad1ead72a7aae2b97cca76b4a8aeeec"}],"m":"92","partition_id":"33db8e1e1b30209166a67dbc630463843b0e2910b5032595f6edf8be46d9e2f0","root":{"bits":"1","count":"1651507","first":"524289","last":"3827301","residue":"1"},"schema":"collatz.root-partition.v1","tree":{"end":"1651506","kind":"leaf","start":"0","unit_id":"dc46c635602629a1993c9667f180c502bad1ead72a7aae2b97cca76b4a8aeeec"}}
