{"config_id":"8860c544c8915438469a4eccdd607f7d32afe7d0403a1c7d6a7445159358cead","k1":"41","leaves":[{"end":"7516192767","start":"0","unit_id":"71ca0cb6902065ae90903981ce8fd26d111756c42f934ff8e8796f076c5da65e"}],"m":"93","partition_id":"f851af68543f870518b1696e337e847ec1df93f549807a079b7b66b0fe84d891","root":{"bits":"1","count":"7516192768","first":"1073741825","last":"16106127359","residue":"1"},"schema":"collatz.root-partition.v1","tree":{"end":"7516192767","kind":"leaf","start":"0","unit_id":"71ca0cb6902065ae90903981ce8fd26d111756c42f934ff8e8796f076c5da65e"}}
