{"config_id":"8860c544c8915438469a4eccdd607f7d32afe7d0403a1c7d6a7445159358cead","k1":"11","leaves":[{"end":"8070450532247928831","start":"0","unit_id":"179eab8639632552244966a0988ffd1e192f5cd8ecdf024735bcaeb9db6801a1"}],"m":"93","partition_id":"f9dfee746ff42efc2fd3cf195afc81e9de953d36e581eae9fe16c20ce0917395","root":{"bits":"1","count":"8070450532247928832","first":"1152921504606846977","last":"17293822569102704639","residue":"1"},"schema":"collatz.root-partition.v1","tree":{"end":"8070450532247928831","kind":"leaf","start":"0","unit_id":"179eab8639632552244966a0988ffd1e192f5cd8ecdf024735bcaeb9db6801a1"}}
