{"config_id":"d58709ce6b8da2cf7db0de16e3b5dba5f0a760880fd306be9ef1440b39333bd5","k1":"40","leaves":[{"end":"24696061951","start":"0","unit_id":"6e9a8299fddef2aab4c577edcd8139ea31c865d74c8b30622349a5d4cc00c1d8"}],"m":"95","partition_id":"fe1915f62f4c280aa588adaf797d6932f1615c8741c47e7c0faed99c606e7efa","root":{"bits":"1","count":"24696061952","first":"2147483649","last":"51539607551","residue":"1"},"schema":"collatz.root-partition.v1","tree":{"end":"24696061951","kind":"leaf","start":"0","unit_id":"6e9a8299fddef2aab4c577edcd8139ea31c865d74c8b30622349a5d4cc00c1d8"}}
