{"config_id":"d58709ce6b8da2cf7db0de16e3b5dba5f0a760880fd306be9ef1440b39333bd5","k1":"68","leaves":[{"end":"91","start":"0","unit_id":"b2cb61bcdac6186c5f971addeafc1e4669fc21db9138d1c389424280a05df521"}],"m":"95","partition_id":"fa0dceb30ce4af9d51552aef1c23154414ee9282759177640998df81f196e8be","root":{"bits":"1","count":"92","first":"9","last":"191","residue":"1"},"schema":"collatz.root-partition.v1","tree":{"end":"91","kind":"leaf","start":"0","unit_id":"b2cb61bcdac6186c5f971addeafc1e4669fc21db9138d1c389424280a05df521"}}
