{"config_id":"39358f1f272587ce9bdd2ff4d530f9a9fe079894092f634e6b9e468bc999b419","k1":"22","leaves":[{"end":"6473924464345087","start":"0","unit_id":"4a5c0c0b1c25a4ef9ad5f8da1a928a0875efecbef7da1d601885e8a44120d358"}],"m":"94","partition_id":"33756d1aaf82322062bea40018334806b10409612852352cf3dc15e4afc7fa6e","root":{"bits":"1","count":"6473924464345088","first":"562949953421313","last":"13510798882111487","residue":"1"},"schema":"collatz.root-partition.v1","tree":{"end":"6473924464345087","kind":"leaf","start":"0","unit_id":"4a5c0c0b1c25a4ef9ad5f8da1a928a0875efecbef7da1d601885e8a44120d358"}}
