{"config_id":"7add73f82f81f6cd6a848b0c782c7e7344740c535af7a7de8166a6e7a046de1d","k1":"55","leaves":[{"end":"917503","start":"0","unit_id":"12e1e449a87e373114ec9686cc4854079ad4ed83ebd553319dfccedf07526176"}],"m":"96","partition_id":"364684873898a5c244b4a0fb01f827822de41e3d1bb83b134358438afbd9cac3","root":{"bits":"1","count":"917504","first":"65537","last":"1900543","residue":"1"},"schema":"collatz.root-partition.v1","tree":{"end":"917503","kind":"leaf","start":"0","unit_id":"12e1e449a87e373114ec9686cc4854079ad4ed83ebd553319dfccedf07526176"}}
