{"config_id":"b95bbdd3004aa0147070166059cccb4b7e0db7a131150f253e6fcb6c6f102098","k1":"59","leaves":[{"end":"12901","start":"0","unit_id":"2fb740244dcc8296ba6a1732c8969432ced90e35c67c9adc08146b0f20b9b526"}],"m":"92","partition_id":"95d1548abbaddfdadf4a427edaa77dc568d3a48d1d4270b4f6fed36e8e18de13","root":{"bits":"1","count":"12902","first":"4097","last":"29899","residue":"1"},"schema":"collatz.root-partition.v1","tree":{"end":"12901","kind":"leaf","start":"0","unit_id":"2fb740244dcc8296ba6a1732c8969432ced90e35c67c9adc08146b0f20b9b526"}}
