{"config_id":"d58709ce6b8da2cf7db0de16e3b5dba5f0a760880fd306be9ef1440b39333bd5","k1":"46","leaves":[{"end":"385875967","start":"0","unit_id":"328ab963dd4251f589be4fa73b28048333c92cf75d4d2c52fe5f6879cd916ced"}],"m":"95","partition_id":"e7926d95f1882a5749912250139808b39fe4af13363d5c52f9780b5371779f99","root":{"bits":"1","count":"385875968","first":"33554433","last":"805306367","residue":"1"},"schema":"collatz.root-partition.v1","tree":{"end":"385875967","kind":"leaf","start":"0","unit_id":"328ab963dd4251f589be4fa73b28048333c92cf75d4d2c52fe5f6879cd916ced"}}
