{"config_id":"b95bbdd3004aa0147070166059cccb4b7e0db7a131150f253e6fcb6c6f102098","k1":"6","leaves":[{"end":"116214487664370175180","start":"0","unit_id":"348621f3717ff38e4fe70f82e4aa5b69a749925801813ce5a3d31471e0876ff3"}],"m":"92","partition_id":"8d48cebb3eae030df0e446623757f72f523781b44e661cc669cf81df9eb09cb7","root":{"bits":"1","count":"116214487664370175181","first":"36893488147419103233","last":"269322463476159453593","residue":"1"},"schema":"collatz.root-partition.v1","tree":{"end":"116214487664370175180","kind":"leaf","start":"0","unit_id":"348621f3717ff38e4fe70f82e4aa5b69a749925801813ce5a3d31471e0876ff3"}}
