{"config_id":"b95bbdd3004aa0147070166059cccb4b7e0db7a131150f253e6fcb6c6f102098","k1":"49","leaves":[{"end":"13212057","start":"0","unit_id":"1b16ad2059d2c594183a86f1570ab63547f82eca1cdcecc71d2eea63ac9d52f9"}],"m":"92","partition_id":"9d17db9706f83f28e41db0faeabed8e5f7cebc9cd47f796c28a2e831214c0e2f","root":{"bits":"1","count":"13212058","first":"4194305","last":"30618419","residue":"1"},"schema":"collatz.root-partition.v1","tree":{"end":"13212057","kind":"leaf","start":"0","unit_id":"1b16ad2059d2c594183a86f1570ab63547f82eca1cdcecc71d2eea63ac9d52f9"}}
