{"config_id":"d58709ce6b8da2cf7db0de16e3b5dba5f0a760880fd306be9ef1440b39333bd5","k1":"1","leaves":[{"end":"13576803638250229989375","start":"0","unit_id":"3d17aaf60825683d012a654f4b47c33ca9e91200acd87a9766fcfbcdf3b9945e"}],"m":"95","partition_id":"2ec2002a643c71b257c3c2677ecdb1443fb305ff5a12bff06749bce134d81c46","root":{"bits":"1","count":"13576803638250229989376","first":"1180591620717411303425","last":"28334198897217871282175","residue":"1"},"schema":"collatz.root-partition.v1","tree":{"end":"13576803638250229989375","kind":"leaf","start":"0","unit_id":"3d17aaf60825683d012a654f4b47c33ca9e91200acd87a9766fcfbcdf3b9945e"}}
