{"config_id":"8860c544c8915438469a4eccdd607f7d32afe7d0403a1c7d6a7445159358cead","k1":"6","leaves":[{"end":"258254417031933722623","start":"0","unit_id":"327d4df01337cb504c5e84070bddce73dc4b8cb9798d1be768fa9e6746605824"}],"m":"93","partition_id":"85c5034c1cd0730144809c9333d568e65e110aeb6388dc954bb3ff07aae5436c","root":{"bits":"1","count":"258254417031933722624","first":"36893488147419103233","last":"553402322211286548479","residue":"1"},"schema":"collatz.root-partition.v1","tree":{"end":"258254417031933722623","kind":"leaf","start":"0","unit_id":"327d4df01337cb504c5e84070bddce73dc4b8cb9798d1be768fa9e6746605824"}}
