{"config_id":"8860c544c8915438469a4eccdd607f7d32afe7d0403a1c7d6a7445159358cead","k1":"30","leaves":[{"end":"15393162788863","start":"0","unit_id":"774a69c258f760f14d37fc8b70a380cd60e1b68072b2fb00b4f19b03811d04a0"}],"m":"93","partition_id":"58bf8412ab4dabe4dfd44721651c4af0b104f2b5c269274b13c56dcc69079e2e","root":{"bits":"1","count":"15393162788864","first":"2199023255553","last":"32985348833279","residue":"1"},"schema":"collatz.root-partition.v1","tree":{"end":"15393162788863","kind":"leaf","start":"0","unit_id":"774a69c258f760f14d37fc8b70a380cd60e1b68072b2fb00b4f19b03811d04a0"}}
