{"config_id":"b95bbdd3004aa0147070166059cccb4b7e0db7a131150f253e6fcb6c6f102098","k1":"26","leaves":[{"end":"110830772079820","start":"0","unit_id":"66e7a612cb51313a02f9d4bf15a5192179642ac970a820fd5a3f9244ab20b649"}],"m":"92","partition_id":"a9c0f7cea1c2b1399c46cf9452912a3cb8ff6daa363de561b412af7a0fa63884","root":{"bits":"1","count":"110830772079821","first":"35184372088833","last":"256845916248473","residue":"1"},"schema":"collatz.root-partition.v1","tree":{"end":"110830772079820","kind":"leaf","start":"0","unit_id":"66e7a612cb51313a02f9d4bf15a5192179642ac970a820fd5a3f9244ab20b649"}}
