{"config_id":"d58709ce6b8da2cf7db0de16e3b5dba5f0a760880fd306be9ef1440b39333bd5","k1":"71","leaves":[{"end":"10","start":"0","unit_id":"cb601fe99272fc4f0e6c7fcdc2954db35447c0eb0f2d40901489d280e8aac67b"}],"m":"95","partition_id":"7e3a03481d6df35712c8f30d4a514ccc9be2c943af880f26c20f275a0f906245","root":{"bits":"1","count":"11","first":"3","last":"23","residue":"1"},"schema":"collatz.root-partition.v1","tree":{"end":"10","kind":"leaf","start":"0","unit_id":"cb601fe99272fc4f0e6c7fcdc2954db35447c0eb0f2d40901489d280e8aac67b"}}
