{"config_id":"7add73f82f81f6cd6a848b0c782c7e7344740c535af7a7de8166a6e7a046de1d","k1":"66","leaves":[{"end":"447","start":"0","unit_id":"9ee8048bd6fe31037e53a8639cc72727c05621f672c783b3e10f6f4c3e09522b"}],"m":"96","partition_id":"cc93aa321558fe7a293fbcadf41cfb30e94cec70c28ce238909eca359427e11e","root":{"bits":"1","count":"448","first":"33","last":"927","residue":"1"},"schema":"collatz.root-partition.v1","tree":{"end":"447","kind":"leaf","start":"0","unit_id":"9ee8048bd6fe31037e53a8639cc72727c05621f672c783b3e10f6f4c3e09522b"}}
