{"config_id":"8860c544c8915438469a4eccdd607f7d32afe7d0403a1c7d6a7445159358cead","k1":"52","leaves":[{"end":"3670015","start":"0","unit_id":"5f45a78f6e692c4779216ff03fbdede46953b21a38ce827692258eac76e5195f"}],"m":"93","partition_id":"32bc4dec2909234f4dbe3a37f25cd1ba9ae8ff00002632690438cf39e54cca1b","root":{"bits":"1","count":"3670016","first":"524289","last":"7864319","residue":"1"},"schema":"collatz.root-partition.v1","tree":{"end":"3670015","kind":"leaf","start":"0","unit_id":"5f45a78f6e692c4779216ff03fbdede46953b21a38ce827692258eac76e5195f"}}
