{"config_id":"8860c544c8915438469a4eccdd607f7d32afe7d0403a1c7d6a7445159358cead","k1":"7","leaves":[{"end":"129127208515966861311","start":"0","unit_id":"f5560e074309edc52723ef1ddfe4be80be522c1a79e7d77a871df66d5488f15d"}],"m":"93","partition_id":"3d127aac66a1441ea9fdef52f0b0eb02360b6e434f3b938674f35a4e9e32cf62","root":{"bits":"1","count":"129127208515966861312","first":"18446744073709551617","last":"276701161105643274239","residue":"1"},"schema":"collatz.root-partition.v1","tree":{"end":"129127208515966861311","kind":"leaf","start":"0","unit_id":"f5560e074309edc52723ef1ddfe4be80be522c1a79e7d77a871df66d5488f15d"}}
