{"config_id":"8860c544c8915438469a4eccdd607f7d32afe7d0403a1c7d6a7445159358cead","k1":"72","leaves":[{"end":"3","start":"0","unit_id":"9e5d9ec841c3a765cefee736f402a41ff9d33f09e488d80fda47822cc671a3ae"}],"m":"93","partition_id":"1f284bdb2565c9328a61ad3a7f98cb29ae48e3073d6244904aad6d4aa0b70f28","root":{"bits":"1","count":"4","first":"1","last":"7","residue":"1"},"schema":"collatz.root-partition.v1","tree":{"end":"3","kind":"leaf","start":"0","unit_id":"9e5d9ec841c3a765cefee736f402a41ff9d33f09e488d80fda47822cc671a3ae"}}
