{"config_id":"39358f1f272587ce9bdd2ff4d530f9a9fe079894092f634e6b9e468bc999b419","k1":"51","leaves":[{"end":"12058623","start":"0","unit_id":"692bc69d2609b0007bcd421b6330054da719ba539af788d321cccc4452d2e3f0"}],"m":"94","partition_id":"eac30c7716c8c990ec7dcb93a8af458a944bcc2ef3a3ee3f2cb088c09f6e1ce0","root":{"bits":"1","count":"12058624","first":"1048577","last":"25165823","residue":"1"},"schema":"collatz.root-partition.v1","tree":{"end":"12058623","kind":"leaf","start":"0","unit_id":"692bc69d2609b0007bcd421b6330054da719ba539af788d321cccc4452d2e3f0"}}
