{"config_id":"b95bbdd3004aa0147070166059cccb4b7e0db7a131150f253e6fcb6c6f102098","k1":"23","leaves":[{"end":"886646176638565","start":"0","unit_id":"a3205c1323eca139d470fa4c9bddade63318fb561e29498fb125b8f16d026b9c"}],"m":"92","partition_id":"a8acd8db67a16bde97c90b856b350ee17d3c9d46eeec20ebc22a0d57077c5c37","root":{"bits":"1","count":"886646176638566","first":"281474976710657","last":"2054767329987787","residue":"1"},"schema":"collatz.root-partition.v1","tree":{"end":"886646176638565","kind":"leaf","start":"0","unit_id":"a3205c1323eca139d470fa4c9bddade63318fb561e29498fb125b8f16d026b9c"}}
