{"config_id":"b95bbdd3004aa0147070166059cccb4b7e0db7a131150f253e6fcb6c6f102098","k1":"22","leaves":[{"end":"1773292353277132","start":"0","unit_id":"56854624951efd31a0daa3a35ac43ad63031bd09b8390a96aff3973085eb81ba"}],"m":"92","partition_id":"2a0ff10aa9050e15ade53a81b76945bdba9b356689919dc28cb78837d850f4fa","root":{"bits":"1","count":"1773292353277133","first":"562949953421313","last":"4109534659975577","residue":"1"},"schema":"collatz.root-partition.v1","tree":{"end":"1773292353277132","kind":"leaf","start":"0","unit_id":"56854624951efd31a0daa3a35ac43ad63031bd09b8390a96aff3973085eb81ba"}}
